"video_part","video_url","video_id","video_title","channel_title","comment_id","parent_id","author_display_name","comment_text","like_count","reply_count","published_at","updated_at","is_reply","collected_at"
"Part 1","https://youtu.be/K8EKqxU-UwM?si=jLs4dyJ1mbPBdQQS","K8EKqxU-UwM","WARNING!! CHAOS 1998 TERULANG?? KITA SEDANG PERANG KEDAULATAN! RAKYAT BERSATU!","Astronacci","UgzX2tZtYofBXb7-wxN4AaABAg","","@irfanhari1444","Berarti jaksanya adalah salah satu dari bagian,","0","0","2026-05-22T09:54:11Z","2026-05-22T09:54:11Z","False","2026-06-16 06:31:44 UTC"
"Part 1","https://youtu.be/K8EKqxU-UwM?si=jLs4dyJ1mbPBdQQS","K8EKqxU-UwM","WARNING!! CHAOS 1998 TERULANG?? KITA SEDANG PERANG KEDAULATAN! RAKYAT BERSATU!","Astronacci","UgyNK_7JEW15UC7poTx4AaABAg","","@devandra5390","Tekanan asing itu nyata…tapi memang banyak kebijakan2 yg belum jelas, president dan pembantunya sering Asbun, kabinet yg mayoritas isinya poli TIKuS….hujatan2 yg datang itu lebih ke faktor pemerintahan sendiri plus ditambah ada tekanan asing membuat semuanya makin runyam. Semoga prabowo bisa lebih siaga menghadapi semuanya","0","0","2026-05-21T12:57:13Z","2026-05-21T12:57:13Z","False","2026-06-16 06:31:44 UTC"
"Part 1","https://youtu.be/K8EKqxU-UwM?si=jLs4dyJ1mbPBdQQS","K8EKqxU-UwM","WARNING!! CHAOS 1998 TERULANG?? KITA SEDANG PERANG KEDAULATAN! RAKYAT BERSATU!","Astronacci","Ugwbc4jf7eOW7JxX-_x4AaABAg","","@refacoeg","Lihat komennya lucu-lucu","0","0","2026-06-07T10:04:27Z","2026-06-07T10:04:27Z","False","2026-06-16 06:31:44 UTC"
"Part 1","https://youtu.be/K8EKqxU-UwM?si=jLs4dyJ1mbPBdQQS","K8EKqxU-UwM","WARNING!! CHAOS 1998 TERULANG?? KITA SEDANG PERANG KEDAULATAN! RAKYAT BERSATU!","Astronacci","Ugx3wmz1iXDB-NzZ0CR4AaABAg","","@dhafyridho1415","✌️✌️✌️✌️","0","0","2026-06-14T15:51:42Z","2026-06-14T15:51:42Z","False","2026-06-16 06:31:44 UTC"
"Part 1","https://youtu.be/K8EKqxU-UwM?si=jLs4dyJ1mbPBdQQS","K8EKqxU-UwM","WARNING!! CHAOS 1998 TERULANG?? KITA SEDANG PERANG KEDAULATAN! RAKYAT BERSATU!","Astronacci","UgzHLR9VJA3XU9ErH_N4AaABAg","","@Mahabatusoda","Serius sebelum gua liat vidio ini gua punya pandangan baik soal pemerintahan yg sedang berjuang...
Setelah liat ini makin terbukalah persepsi keyakinan gua tersebut...","0","0","2026-05-24T13:04:57Z","2026-05-24T13:04:57Z","False","2026-06-16 06:31:44 UTC"
"Part 1","https://youtu.be/K8EKqxU-UwM?si=jLs4dyJ1mbPBdQQS","K8EKqxU-UwM","WARNING!! CHAOS 1998 TERULANG?? KITA SEDANG PERANG KEDAULATAN! RAKYAT BERSATU!","Astronacci","UgwJLNrj1qiOa4wijmd4AaABAg","","@andhikaaryaperdana6843","Kerusuhan harusnya menjadi puncak di era jokowi. Akan tetapi terkendali sehingga kita berhasil melewati itu. Maka kita harus selalu terkendali untuk melewati apa yang ada sekarang ini.","0","0","2026-06-10T12:50:08Z","2026-06-10T12:50:08Z","False","2026-06-16 06:31:44 UTC"
"Part 1","https://youtu.be/K8EKqxU-UwM?si=jLs4dyJ1mbPBdQQS","K8EKqxU-UwM","WARNING!! CHAOS 1998 TERULANG?? KITA SEDANG PERANG KEDAULATAN! RAKYAT BERSATU!","Astronacci","Ugx6uM0jxVHOFQDSeGd4AaABAg","","@david_indo","Saya percaya pemerintah untuk memajukan Indonesia, tapi kami ngak butuh PROMO MBG yang tidak ada manfaat langsung untuk EKONOMI INDONESIA TERCINTA❤","0","0","2026-05-22T15:59:00Z","2026-05-22T15:59:00Z","False","2026-06-16 06:31:44 UTC"
"Part 1","https://youtu.be/K8EKqxU-UwM?si=jLs4dyJ1mbPBdQQS","K8EKqxU-UwM","WARNING!! CHAOS 1998 TERULANG?? KITA SEDANG PERANG KEDAULATAN! RAKYAT BERSATU!","Astronacci","UgzQPkp-GiX5hCZFzw94AaABAg","","@ecg8004","Bro, cuman 2 alasan, inkompeten dan KORUP!","0","0","2026-06-14T07:50:02Z","2026-06-14T07:50:02Z","False","2026-06-16 06:31:44 UTC"
"Part 1","https://youtu.be/K8EKqxU-UwM?si=jLs4dyJ1mbPBdQQS","K8EKqxU-UwM","WARNING!! CHAOS 1998 TERULANG?? KITA SEDANG PERANG KEDAULATAN! RAKYAT BERSATU!","Astronacci","UgyGgr_O1nyIUGReVLh4AaABAg","","@WongAlit385","Saya dukung pemerintah","1","0","2026-05-23T08:25:54Z","2026-05-23T08:25:54Z","False","2026-06-16 06:31:44 UTC"
"Part 1","https://youtu.be/K8EKqxU-UwM?si=jLs4dyJ1mbPBdQQS","K8EKqxU-UwM","WARNING!! CHAOS 1998 TERULANG?? KITA SEDANG PERANG KEDAULATAN! RAKYAT BERSATU!","Astronacci","Ugya_x6SYisThIT3K8Z4AaABAg","","@pusatsewamotor.kotamalang","💙💙💙💙💙💙💙💙💙💙💙💙💙","0","0","2026-05-24T14:00:18Z","2026-05-24T14:00:18Z","False","2026-06-16 06:31:44 UTC"
"Part 1","https://youtu.be/K8EKqxU-UwM?si=jLs4dyJ1mbPBdQQS","K8EKqxU-UwM","WARNING!! CHAOS 1998 TERULANG?? KITA SEDANG PERANG KEDAULATAN! RAKYAT BERSATU!","Astronacci","Ugyu3Jt6GSqifXu1IIl4AaABAg","","@agoysy","97 sudah pinjam IMF pak.","0","0","2026-05-21T18:19:04Z","2026-05-21T18:19:04Z","False","2026-06-16 06:31:44 UTC"
"Part 1","https://youtu.be/K8EKqxU-UwM?si=jLs4dyJ1mbPBdQQS","K8EKqxU-UwM","WARNING!! CHAOS 1998 TERULANG?? KITA SEDANG PERANG KEDAULATAN! RAKYAT BERSATU!","Astronacci","UgzO_xwX_nT5sSMBB-d4AaABAg","","@andi125andi12","Tegak kn uu perampasan aset KLO mau membenah semua ini","0","0","2026-05-23T11:55:45Z","2026-05-23T11:55:45Z","False","2026-06-16 06:31:44 UTC"
"Part 1","https://youtu.be/K8EKqxU-UwM?si=jLs4dyJ1mbPBdQQS","K8EKqxU-UwM","WARNING!! CHAOS 1998 TERULANG?? KITA SEDANG PERANG KEDAULATAN! RAKYAT BERSATU!","Astronacci","UgzbfsN6t9v4KqhlkW14AaABAg","","@HendraSaputra-yw2eo","sebentar ekonomi kita tidak sedang naik angka 5,61% itu didapat dari governmen spending yang gila2an sampai 21% bukan karena daya beli masyarakat yang naik dan juga kenaikan investasi jd aslinya itu pertumbuhannya cm 4,6%, tidak ada perbaikan sedikitpun","0","0","2026-05-21T14:58:31Z","2026-05-21T15:01:00Z","False","2026-06-16 06:31:44 UTC"
"Part 1","https://youtu.be/K8EKqxU-UwM?si=jLs4dyJ1mbPBdQQS","K8EKqxU-UwM","WARNING!! CHAOS 1998 TERULANG?? KITA SEDANG PERANG KEDAULATAN! RAKYAT BERSATU!","Astronacci","Ugy_rt43uBtIkgyxqiV4AaABAg","","@KAWANPETERNAK","Kalau seperti ini kenapa yg nonton dikit","0","0","2026-05-21T11:37:57Z","2026-05-21T11:37:57Z","False","2026-06-16 06:31:44 UTC"
"Part 1","https://youtu.be/K8EKqxU-UwM?si=jLs4dyJ1mbPBdQQS","K8EKqxU-UwM","WARNING!! CHAOS 1998 TERULANG?? KITA SEDANG PERANG KEDAULATAN! RAKYAT BERSATU!","Astronacci","UgzE_U1sqY__zZTFiY94AaABAg","","@dyanitasariindah","Gue percaya sama pemerintahan ini, karena gue percaya sama pak org yg masih jujur dan cinta tanah air conyoh  purbaya ..para yg punya kepentingan  ketakutan sama KPK dan pak purbaya dll utk berantas orang2 gak bener dipemerintahan ini yg mereka di balik layar ..sebenarnya  pak prabowo harus tetap dalam llingkaran org baik jadi yg bisikin yg benar2 cinta negara, kita rakyat bantu koq support asal kebijakan bapak presiden baik utk rakyat, ..","0","0","2026-06-09T22:26:25Z","2026-06-09T22:26:25Z","False","2026-06-16 06:31:44 UTC"
"Part 1","https://youtu.be/K8EKqxU-UwM?si=jLs4dyJ1mbPBdQQS","K8EKqxU-UwM","WARNING!! CHAOS 1998 TERULANG?? KITA SEDANG PERANG KEDAULATAN! RAKYAT BERSATU!","Astronacci","Ugz---GnMXxwLrp91-94AaABAg","","@AsepSyaripuddin-y3i","Analisa yg sangat masuk akal, tinggal satu lagi para preman bayaran siap demo2 bikin keributan,","0","0","2026-05-21T10:21:59Z","2026-05-21T10:21:59Z","False","2026-06-16 06:31:44 UTC"
"Part 1","https://youtu.be/K8EKqxU-UwM?si=jLs4dyJ1mbPBdQQS","K8EKqxU-UwM","WARNING!! CHAOS 1998 TERULANG?? KITA SEDANG PERANG KEDAULATAN! RAKYAT BERSATU!","Astronacci","Ugzct6Q8rQg4v1DhiN54AaABAg","","@kajigamer2143","narasi-narasi negatif banyak dikeluarkan, ada sesuatu yang ingin dicapai.

memang banyak hal yang kurang di pemerintahan sekarang, tapi dengan narasi negatif yang berdampak buruk seperti yang diinginkan, kita akan lebih menderita.","0","0","2026-05-24T14:36:43Z","2026-05-24T14:36:43Z","False","2026-06-16 06:31:44 UTC"
"Part 1","https://youtu.be/K8EKqxU-UwM?si=jLs4dyJ1mbPBdQQS","K8EKqxU-UwM","WARNING!! CHAOS 1998 TERULANG?? KITA SEDANG PERANG KEDAULATAN! RAKYAT BERSATU!","Astronacci","UgwazBcsGu7Ntxy-FHR4AaABAg","","@muhamadalifulloh","Bengisnya semua di negara ini apah2 harus di korupsi andai tidak ada korupsi di negeri ini mungkin sudah menjadi negara Semaju apah","0","0","2026-05-22T12:56:39Z","2026-05-22T12:56:39Z","False","2026-06-16 06:31:44 UTC"
"Part 1","https://youtu.be/K8EKqxU-UwM?si=jLs4dyJ1mbPBdQQS","K8EKqxU-UwM","WARNING!! CHAOS 1998 TERULANG?? KITA SEDANG PERANG KEDAULATAN! RAKYAT BERSATU!","Astronacci","UgwpJtt9opPT_ClrLvZ4AaABAg","","@gedekrisnayana2288","Bagimana bisa percaya pemerintah jika komunakasi dengan masy kurang bagus, kebijakan kurang tepat
Kita cinta indonesia, dan bapak presiden tapi tolong sampaikan dengan kejujuran apapun masalah bangsa ini","0","0","2026-05-22T11:15:48Z","2026-05-22T11:15:48Z","False","2026-06-16 06:31:44 UTC"
"Part 1","https://youtu.be/K8EKqxU-UwM?si=jLs4dyJ1mbPBdQQS","K8EKqxU-UwM","WARNING!! CHAOS 1998 TERULANG?? KITA SEDANG PERANG KEDAULATAN! RAKYAT BERSATU!","Astronacci","Ugyq8At9wZCR4KtH_OR4AaABAg","","@perspektifx6589","setelah menonton ini, pemikiran gw seimbang terhadap pak prabowo. tapi tetap, korupsi pejabat dan kepala daerah tambah ganas","0","0","2026-05-22T06:09:27Z","2026-05-22T06:09:27Z","False","2026-06-16 06:31:44 UTC"
"Part 1","https://youtu.be/K8EKqxU-UwM?si=jLs4dyJ1mbPBdQQS","K8EKqxU-UwM","WARNING!! CHAOS 1998 TERULANG?? KITA SEDANG PERANG KEDAULATAN! RAKYAT BERSATU!","Astronacci","UgweF7IZ2fhCbNUgJwx4AaABAg","","@febricandra5875","aku mencium bau bau mafia mafia koruptor di Indonesia kerja sama dgn pihak asing terutama Amerika untuk mengulingkan Prabowo. korupsi skrng di berantas tanpa pandang bulu. trus Indonesia main dua kaki dn lebih condong ke blok timur. gimana nggak panas Amerika. apalagi skrng qris udh bisa di pakai di China dgn transaksi tidak mengunakan dolan lagi tpi dgn mata uang yaun China. ini terang terangan ninggalin dolar loh Prabowo. semoga pak Prabowo slalu di lindungi. di beri kesehatan kekuatan buat menjaga kedaulatan negeri ini. dn buat rakyat yang masih oon bodo tolong cpet sadar dn benahi pola pikir nya negara Lo bukan boneka lagi kita harus berdiri di kaki sendiri.","0","0","2026-05-22T16:01:59Z","2026-05-22T16:01:59Z","False","2026-06-16 06:31:44 UTC"
"Part 1","https://youtu.be/K8EKqxU-UwM?si=jLs4dyJ1mbPBdQQS","K8EKqxU-UwM","WARNING!! CHAOS 1998 TERULANG?? KITA SEDANG PERANG KEDAULATAN! RAKYAT BERSATU!","Astronacci","UgyDYxwHZQ2T8Ik5Q-F4AaABAg","","@sugauga6411","Jadi di bandara singapore ttg diskon jual rupiah, tujuannya untuk membuat nilai rupiah lemah?😊","0","0","2026-06-12T07:10:58Z","2026-06-12T07:10:58Z","False","2026-06-16 06:31:44 UTC"
"Part 1","https://youtu.be/K8EKqxU-UwM?si=jLs4dyJ1mbPBdQQS","K8EKqxU-UwM","WARNING!! CHAOS 1998 TERULANG?? KITA SEDANG PERANG KEDAULATAN! RAKYAT BERSATU!","Astronacci","Ugx2ZSDcYi-9CIMEpmV4AaABAg","","@Ivydale-z6c","sebagai rakyat awam yg kurang dalam memahami dan mengetahui geopolitik pemerintah secara dalam. muncul pertanyaan dari saya, setelah melihat vidio ini.
1. Presiden kita kompeten, dan pastinya sangat amat memahami tata kepemerintahan. Tetapi kenapa saat pers, beliau tidak mengedukasi rakyatnya dg kalimat² yg bisa menurunkan kecemasan masyarakat.
2. Jika Soeharto pada 98 tidak dipaksa turun jabatan, bagaimana praktek KKN yg terjadi saat masa jabatan beliau? apakah menjabat sebagai presiden selama ±30 tahun itu merupakan wajah negara demokrasi? kenapa tidak dibahas juga hutang² negara selama masa kepemerintahan soeharto?
3. Keblunderan dari menteri² kabinet prabowo, merupakan bukti ketidak mampuan jajarannya dalam berkomunikasi didepan publik. Kenapa melantik menteri² yg tidak berkompeten, dan banyak menyebabkan kontroversi karena ucapannya?","0","0","2026-05-23T09:48:28Z","2026-05-23T09:48:28Z","False","2026-06-16 06:31:44 UTC"
"Part 1","https://youtu.be/K8EKqxU-UwM?si=jLs4dyJ1mbPBdQQS","K8EKqxU-UwM","WARNING!! CHAOS 1998 TERULANG?? KITA SEDANG PERANG KEDAULATAN! RAKYAT BERSATU!","Astronacci","UgyriyJ7_N7cRwTfU7V4AaABAg","","@radenlokajaya93","Percaya atau tidak, masih banyak influencer kita yg menggadaikan harga dirinya, daripada membela negara lebih memilih menerima pemberian oknum utk membuat konten yg menjatuhkan pemerintahan Pak Prabowo dan menebarkan kebencian.","1","0","2026-05-21T12:59:05Z","2026-05-21T12:59:05Z","False","2026-06-16 06:31:44 UTC"
"Part 1","https://youtu.be/K8EKqxU-UwM?si=jLs4dyJ1mbPBdQQS","K8EKqxU-UwM","WARNING!! CHAOS 1998 TERULANG?? KITA SEDANG PERANG KEDAULATAN! RAKYAT BERSATU!","Astronacci","UgySuyPpTLkkHuvfPgR4AaABAg","","@CobaAja-z1b","Bro gimana cara bisa diskusi dengan anda","0","0","2026-05-22T00:58:02Z","2026-05-22T00:58:02Z","False","2026-06-16 06:31:44 UTC"
"Part 1","https://youtu.be/K8EKqxU-UwM?si=jLs4dyJ1mbPBdQQS","K8EKqxU-UwM","WARNING!! CHAOS 1998 TERULANG?? KITA SEDANG PERANG KEDAULATAN! RAKYAT BERSATU!","Astronacci","UgzZm77kW6n4fdStrb94AaABAg","","@masagaudiocell","Solusi untuk ini gmn pak ?
Kita hrs apa sbg warga ?","0","0","2026-05-21T11:39:30Z","2026-05-21T11:39:30Z","False","2026-06-16 06:31:44 UTC"
"Part 1","https://youtu.be/K8EKqxU-UwM?si=jLs4dyJ1mbPBdQQS","K8EKqxU-UwM","WARNING!! CHAOS 1998 TERULANG?? KITA SEDANG PERANG KEDAULATAN! RAKYAT BERSATU!","Astronacci","Ugy5o3ULVv8ToeZ5K7p4AaABAg","","@6033_ZulAnggara","Reformasi jilid 1 jelas. Seluruh indo menginginkan Soeharto turun, yg sekarang kan nggak semua, masih buanyak bngt yg cinta sama pak Prabowo. Apakah ngga akan pecah belah bangsa ini?","0","0","2026-06-10T01:37:05Z","2026-06-10T01:37:05Z","False","2026-06-16 06:31:44 UTC"
"Part 1","https://youtu.be/K8EKqxU-UwM?si=jLs4dyJ1mbPBdQQS","K8EKqxU-UwM","WARNING!! CHAOS 1998 TERULANG?? KITA SEDANG PERANG KEDAULATAN! RAKYAT BERSATU!","Astronacci","UgyS9Wqgw-b6TLydiU14AaABAg","","@starofficial5127","yang benci doang ama presiden tapi ga dapat bagian apa2 untuk membenci, cpt2 hilangkan perasaan itu. jgn goblok2 bgt, sosial media itu terlalu berbahaya utk dijadikan pedoman. mreka enak framing sana sni dapat bagian. elu yg benci krna kemakan framing justru yg rugi. bagian kaga dapat, negara krisis yang rugi ya elu2 juga, presiden lengser hartanya uda banyak. tetap bisa makan enak tiap hari.","1","0","2026-05-21T11:10:33Z","2026-05-21T11:10:33Z","False","2026-06-16 06:31:44 UTC"
"Part 1","https://youtu.be/K8EKqxU-UwM?si=jLs4dyJ1mbPBdQQS","K8EKqxU-UwM","WARNING!! CHAOS 1998 TERULANG?? KITA SEDANG PERANG KEDAULATAN! RAKYAT BERSATU!","Astronacci","Ugyzyix8plI9RW2Ubyt4AaABAg","","@muamarhana8783","pak  mau tanya itu bikin pptnya pake tools apa?","0","0","2026-05-22T10:11:33Z","2026-05-22T10:11:33Z","False","2026-06-16 06:31:44 UTC"
"Part 1","https://youtu.be/K8EKqxU-UwM?si=jLs4dyJ1mbPBdQQS","K8EKqxU-UwM","WARNING!! CHAOS 1998 TERULANG?? KITA SEDANG PERANG KEDAULATAN! RAKYAT BERSATU!","Astronacci","UgzSZQenRhyIPn6Ts7R4AaABAg","","@mampirngombe118","Sya tetap lebih percaya apa kata GusDur ttg Prabowo daripada Nana gelap","0","0","2026-05-24T03:21:11Z","2026-05-24T03:21:11Z","False","2026-06-16 06:31:44 UTC"
"Part 1","https://youtu.be/K8EKqxU-UwM?si=jLs4dyJ1mbPBdQQS","K8EKqxU-UwM","WARNING!! CHAOS 1998 TERULANG?? KITA SEDANG PERANG KEDAULATAN! RAKYAT BERSATU!","Astronacci","UgyEUZUg8p-Wn4wNC7Z4AaABAg","","@yayatsupriyatna1256","Mari kita bersatu lawan asing...NKRI harga mati","0","0","2026-05-21T09:04:00Z","2026-05-21T09:04:00Z","False","2026-06-16 06:31:44 UTC"
"Part 1","https://youtu.be/K8EKqxU-UwM?si=jLs4dyJ1mbPBdQQS","K8EKqxU-UwM","WARNING!! CHAOS 1998 TERULANG?? KITA SEDANG PERANG KEDAULATAN! RAKYAT BERSATU!","Astronacci","UgwA8VI4mlvB3FWe5Qt4AaABAg","","@hamdanicitizens4447","jaga diri prof gema ngeri dapet ancaman","0","0","2026-06-14T22:32:18Z","2026-06-14T22:32:18Z","False","2026-06-16 06:31:44 UTC"
"Part 1","https://youtu.be/K8EKqxU-UwM?si=jLs4dyJ1mbPBdQQS","K8EKqxU-UwM","WARNING!! CHAOS 1998 TERULANG?? KITA SEDANG PERANG KEDAULATAN! RAKYAT BERSATU!","Astronacci","UgwqsyVpV3es2j5OAHR4AaABAg","","@paksuyud3902","Tolong video ini di rekam atau download supaya bisa di sebarkan ke semua penduduk Indonesia takut nya di banned YouTube, intinya Prabowo ini sedang melawan mafia Singapura, Malaysia,dan mafia Indonesia","0","0","2026-05-21T08:54:21Z","2026-05-21T08:54:46Z","False","2026-06-16 06:31:44 UTC"
"Part 1","https://youtu.be/K8EKqxU-UwM?si=jLs4dyJ1mbPBdQQS","K8EKqxU-UwM","WARNING!! CHAOS 1998 TERULANG?? KITA SEDANG PERANG KEDAULATAN! RAKYAT BERSATU!","Astronacci","UgypTA1Qvgv4JRRX6yh4AaABAg","","@bellaita5166","Saya gak suka sama pemerintahan sekarang apalagi para pejabatnya yg asbun sampai kapanpun saya akan terus berisik tapi saya tidak mau menggulingkan presiden siapapun presidennya..... pak prabowo maju terus jangan menyerah...","0","0","2026-05-21T15:57:43Z","2026-05-21T15:57:43Z","False","2026-06-16 06:31:44 UTC"
"Part 1","https://youtu.be/K8EKqxU-UwM?si=jLs4dyJ1mbPBdQQS","K8EKqxU-UwM","WARNING!! CHAOS 1998 TERULANG?? KITA SEDANG PERANG KEDAULATAN! RAKYAT BERSATU!","Astronacci","UgyGBgx3IK2j_LVcfiJ4AaABAg","","@abm4082","Sayangnya orang indonesia gak bisa liat dari pov lain","0","0","2026-05-23T05:39:25Z","2026-05-23T05:39:25Z","False","2026-06-16 06:31:44 UTC"
"Part 1","https://youtu.be/K8EKqxU-UwM?si=jLs4dyJ1mbPBdQQS","K8EKqxU-UwM","WARNING!! CHAOS 1998 TERULANG?? KITA SEDANG PERANG KEDAULATAN! RAKYAT BERSATU!","Astronacci","Ugwz8x4BZo0LAZLwl_d4AaABAg","","@KakiLima-b2p8r","IMF kok saya jadi inget seseorang ya","0","0","2026-05-21T12:20:22Z","2026-05-21T12:20:22Z","False","2026-06-16 06:31:44 UTC"
"Part 1","https://youtu.be/K8EKqxU-UwM?si=jLs4dyJ1mbPBdQQS","K8EKqxU-UwM","WARNING!! CHAOS 1998 TERULANG?? KITA SEDANG PERANG KEDAULATAN! RAKYAT BERSATU!","Astronacci","Ugyck1vB8jnr3JZMQjJ4AaABAg","","@KeitoRyuki","Pak gema mau tanya ? Kenapa pemerintah gak mau ubah sistem dalam negri ya pak ,saya tau sistem ini sudah mengakar di negara kita ,but kenapa nggak coba di ubah ya pak ,mohon jawabannya saya juga penasaran soalnya why not change","0","0","2026-05-22T15:08:30Z","2026-05-22T15:08:30Z","False","2026-06-16 06:31:44 UTC"
"Part 1","https://youtu.be/K8EKqxU-UwM?si=jLs4dyJ1mbPBdQQS","K8EKqxU-UwM","WARNING!! CHAOS 1998 TERULANG?? KITA SEDANG PERANG KEDAULATAN! RAKYAT BERSATU!","Astronacci","Ugzz1iN6sX4vn8ol1rF4AaABAg","","@JojoRisa-v2o","Ini nunjukin kasus 98 sudah mulai di  mulai lgi di indonesia.....karna sekrang provokasi sedang marak di indonesia....singapore mulai bekerja menjatuhkan indonesia dengan dolar nya agar pengusaha2 menyimpan duit nya ke singapore...dengan bgtu singapore bisa menguat....makanya bnyk influencer marak mempromosikan bank2 singpore agar nabung di sana....sekrg yg jadi tumbal papua agar bisa meledak emosi kita dengan bgtu semua akan membenci pemerintah....sdgkan 98 yg jadi kambing hitam org cindo yg jd sasaran....semoga indonesia bisa bertahan dan damai sampai kpn pun.....inget kawan amerika lagi menekan indonesia.....mereka sudah mengglontorkan duit2 di universitas2 yg mau di sogok duit dan boom pesta babi beredar....dulu waktu soekarno bom g30 spki.....bom 98 muncul korupsi besar2an....padahl indonesia lg mempersiapkan pesawat buata.an bj habibie....sayg bgt indonesia masih di kendalikan negara lain....indonesia sabar lah","0","0","2026-05-22T00:06:18Z","2026-05-22T00:06:18Z","False","2026-06-16 06:31:44 UTC"
"Part 1","https://youtu.be/K8EKqxU-UwM?si=jLs4dyJ1mbPBdQQS","K8EKqxU-UwM","WARNING!! CHAOS 1998 TERULANG?? KITA SEDANG PERANG KEDAULATAN! RAKYAT BERSATU!","Astronacci","Ugx4Q_r4FzJfUPZXH7Z4AaABAg","","@Alilthinker","Siapa tau ga ngerti kedaulatan negara, sederhananya Indonesia yang mengendalikan segala sesuatu atas negara. Sm kyk kedaulatan Tuhan, nah semua yg terjadi dlm hidup kita ada dlm kedaulatan Tuhan, aka “suka-suka Tuhan”. Smg terbayang ya sederhananya","0","1","2026-06-11T11:29:31Z","2026-06-11T11:29:31Z","False","2026-06-16 06:31:44 UTC"
"Part 1","https://youtu.be/K8EKqxU-UwM?si=jLs4dyJ1mbPBdQQS","K8EKqxU-UwM","WARNING!! CHAOS 1998 TERULANG?? KITA SEDANG PERANG KEDAULATAN! RAKYAT BERSATU!","Astronacci","Ugz9xAB9N37wUNFVIYx4AaABAg","","@gawin212","Influencer ini bilang bgini,
Influencer itu bilang bgtu,

Jadinya bikin bingung, walhasil mnding tontonin ajalah, gamau ikut2an, klo ada yg ajak demo, ogah ngikut.
Kalo ada yg ajak boikot, ogah ngikut jg kalo butuh barang itu

Intinya skrg realistis, liatin dlu alurnya, usahain bertindaknya ga ngikutin kemauan pihak Ono dan ini.

Klo ngikut pihak Ono/ini takutnya salah.

Tp emang skrg banyak bgt sih influencer 2 massive yg sama2 mematahkan opini, baik opini pemerintah maupun opini influencer yang kritik pemerintah

Jd pilihan terbaik saat ini kayanya emang cukup diam dan amati, krna klo kita tidak ikut2an kemauan 2 pihak yg Ono dan ini, otomatis tujuan mereka ga akan berjalan","0","0","2026-05-22T10:52:31Z","2026-05-22T10:52:31Z","False","2026-06-16 06:31:44 UTC"
"Part 1","https://youtu.be/K8EKqxU-UwM?si=jLs4dyJ1mbPBdQQS","K8EKqxU-UwM","WARNING!! CHAOS 1998 TERULANG?? KITA SEDANG PERANG KEDAULATAN! RAKYAT BERSATU!","Astronacci","Ugzlon-wgR7xO3I6mip4AaABAg","","@SebastianHutomo","96 + 97 ada full blood🌚 Krisis dmule thn 97. & mei 98 krusuhan + jg ada el nino..","0","0","2026-05-22T13:53:46Z","2026-05-22T13:53:46Z","False","2026-06-16 06:31:44 UTC"
"Part 1","https://youtu.be/K8EKqxU-UwM?si=jLs4dyJ1mbPBdQQS","K8EKqxU-UwM","WARNING!! CHAOS 1998 TERULANG?? KITA SEDANG PERANG KEDAULATAN! RAKYAT BERSATU!","Astronacci","UgyRzBvyZts_61bAGgZ4AaABAg","","@andanapratama6594","Sayangnya banyak yg lebih suka nonton video potongan yg menjelek-jelekan pemerintah","0","0","2026-06-15T15:38:25Z","2026-06-15T15:38:25Z","False","2026-06-16 06:31:44 UTC"
"Part 1","https://youtu.be/K8EKqxU-UwM?si=jLs4dyJ1mbPBdQQS","K8EKqxU-UwM","WARNING!! CHAOS 1998 TERULANG?? KITA SEDANG PERANG KEDAULATAN! RAKYAT BERSATU!","Astronacci","UgwEkWa-us0Bt9mwv-d4AaABAg","","@ernakarwita5841","Presiden dan Wapres sedang bekerja berikanlah mereka kesempatan untuk memperbaiki negara di segala aspek yang sudah seperti benang kusut bahkan simpulnya sudah mengikat kuat","0","0","2026-06-10T22:44:46Z","2026-06-10T22:44:46Z","False","2026-06-16 06:31:44 UTC"
"Part 1","https://youtu.be/K8EKqxU-UwM?si=jLs4dyJ1mbPBdQQS","K8EKqxU-UwM","WARNING!! CHAOS 1998 TERULANG?? KITA SEDANG PERANG KEDAULATAN! RAKYAT BERSATU!","Astronacci","UgyJ4mDNWu9JIFqDIid4AaABAg","","@sumarniwahab3064","Naiff","1","0","2026-06-13T04:00:23Z","2026-06-13T04:00:23Z","False","2026-06-16 06:31:44 UTC"
"Part 1","https://youtu.be/K8EKqxU-UwM?si=jLs4dyJ1mbPBdQQS","K8EKqxU-UwM","WARNING!! CHAOS 1998 TERULANG?? KITA SEDANG PERANG KEDAULATAN! RAKYAT BERSATU!","Astronacci","UgxJw9mGXLs7-Bxg6gx4AaABAg","","@Vickyweef","Ijin tanya pak, lalu sikap kita sbg masyarakat sipil harus gimana pak? Faktanya rupiah terus naik, harga bahan pokok makin tinggi sedangkan gaji kita pas2an","0","0","2026-05-21T23:12:34Z","2026-05-21T23:13:16Z","False","2026-06-16 06:31:44 UTC"
"Part 1","https://youtu.be/K8EKqxU-UwM?si=jLs4dyJ1mbPBdQQS","K8EKqxU-UwM","WARNING!! CHAOS 1998 TERULANG?? KITA SEDANG PERANG KEDAULATAN! RAKYAT BERSATU!","Astronacci","UgyFvyhD2y8yWlVljI94AaABAg","","@deryanadisaputra5485","2 2 nya cinta uang kali prof? 😂","0","0","2026-06-10T09:35:46Z","2026-06-10T09:35:46Z","False","2026-06-16 06:31:44 UTC"
"Part 1","https://youtu.be/K8EKqxU-UwM?si=jLs4dyJ1mbPBdQQS","K8EKqxU-UwM","WARNING!! CHAOS 1998 TERULANG?? KITA SEDANG PERANG KEDAULATAN! RAKYAT BERSATU!","Astronacci","UgzqhmE-C6BQAyUzL_d4AaABAg","","@bangconi7497","us slap lagi kah ini?","0","0","2026-06-06T07:29:16Z","2026-06-06T07:29:16Z","False","2026-06-16 06:31:44 UTC"
"Part 1","https://youtu.be/K8EKqxU-UwM?si=jLs4dyJ1mbPBdQQS","K8EKqxU-UwM","WARNING!! CHAOS 1998 TERULANG?? KITA SEDANG PERANG KEDAULATAN! RAKYAT BERSATU!","Astronacci","UgydsGOkZR1rb4RrueJ4AaABAg","","@Noeldesaza","Terlalu banyak orang pintar yg merugikan negara ini","0","0","2026-06-09T17:49:52Z","2026-06-09T17:49:52Z","False","2026-06-16 06:31:44 UTC"
"Part 1","https://youtu.be/K8EKqxU-UwM?si=jLs4dyJ1mbPBdQQS","K8EKqxU-UwM","WARNING!! CHAOS 1998 TERULANG?? KITA SEDANG PERANG KEDAULATAN! RAKYAT BERSATU!","Astronacci","UgwFhWN11z4GXEzVqIt4AaABAg","","@hrwstudio4104","Tetep i stand on Bubarkan MBG","1","0","2026-05-21T22:30:45Z","2026-05-21T22:30:45Z","False","2026-06-16 06:31:44 UTC"
"Part 1","https://youtu.be/K8EKqxU-UwM?si=jLs4dyJ1mbPBdQQS","K8EKqxU-UwM","WARNING!! CHAOS 1998 TERULANG?? KITA SEDANG PERANG KEDAULATAN! RAKYAT BERSATU!","Astronacci","Ugxb-2EJr5VwREb5lC94AaABAg","","@masac2018","Kalo Soeharto di jatuhkan IMF+USA saya gak keberatan karena rakyat sudah sangat menderita. 11/12 seperti mantunya","1","0","2026-05-21T13:42:07Z","2026-05-21T13:42:07Z","False","2026-06-16 06:31:44 UTC"
"Part 1","https://youtu.be/K8EKqxU-UwM?si=jLs4dyJ1mbPBdQQS","K8EKqxU-UwM","WARNING!! CHAOS 1998 TERULANG?? KITA SEDANG PERANG KEDAULATAN! RAKYAT BERSATU!","Astronacci","UgwCpQ-9Nv4lECVs3FR4AaABAg","","@jotocarloschannel","salah satu faktor kekecauan sistem negara ini.... Kabinet gemoy bin MANUSIA PARTAI bukan para profesional","0","0","2026-05-21T13:23:15Z","2026-05-21T13:23:15Z","False","2026-06-16 06:31:44 UTC"
"Part 1","https://youtu.be/K8EKqxU-UwM?si=jLs4dyJ1mbPBdQQS","K8EKqxU-UwM","WARNING!! CHAOS 1998 TERULANG?? KITA SEDANG PERANG KEDAULATAN! RAKYAT BERSATU!","Astronacci","Ugz8VsDBT6lBITYKpmF4AaABAg","","@kayisyunavian5494","Jadi permaslahan 
1. kalo kita gak ingin di setir amerika saham indonesia harus di beli orang2 indonesia sendiri walaupun cuan kecil 
2.hukum mati korupsi...
3.indonesia jgn mau di dekte lagi kyak dulu ....","0","0","2026-05-22T09:14:54Z","2026-05-22T09:14:54Z","False","2026-06-16 06:31:44 UTC"
"Part 1","https://youtu.be/K8EKqxU-UwM?si=jLs4dyJ1mbPBdQQS","K8EKqxU-UwM","WARNING!! CHAOS 1998 TERULANG?? KITA SEDANG PERANG KEDAULATAN! RAKYAT BERSATU!","Astronacci","UgxnZnhTZoIs9yxwbN14AaABAg","","@concealstore","Klipper2 tolong sebarkan video ini. Karena masyarakat indo lebih suka nonton video pendek 🙌","0","0","2026-05-22T01:32:24Z","2026-05-22T01:32:24Z","False","2026-06-16 06:31:44 UTC"
